{
  "schema": "smml.game-target-inspection-plan/1",
  "steamAppId": 387990,
  "canonicalPolicy": "smml.canonical-game-policy/2",
  "builds": [
    {
      "steamBuildId": "25442087",
      "steamBranch": "public",
      "gameVersion": "1.0.6",
      "engineBuild": 889,
      "gameOs": "windows",
      "gameArch": "x86_64",
      "rootFingerprints": [
        "Cache",
        "ChallengeData",
        "Challenges",
        "Data",
        "ParticleEditorData",
        "Release",
        "Survival"
      ],
      "targetFingerprints": [
        "Cache/Bundle/core_data.cbo",
        "Survival/Scripts/game/SurvivalGame.lua",
        "Survival/Scripts/game/SurvivalPlayer.lua",
        "Survival/Scripts/game/interactables/ResourceContainer.lua",
        "Survival/Scripts/game/tools/CarryTool.lua",
        "installscript.vdf"
      ],
      "knownCanonicalGameFingerprints": [
        "f8356e5f0b660320bdcd196bc553114d688aeff43f20872438cbac1e1bc9668c"
      ]
    }
  ]
}
